"evi","Evi'","see also [sexy beastess] the 'evi' are known for their intelligence as well as their exceptional fencing capabilities.  the evi can be extremely dangerous if you get on their bad side.  if one were to by chance become the enemy of an evi, it would be easier for them to just commit suicide on the spot, the evi are a cunning foe.  they are also known to be good friends in time of need. "
"evr","Ever","whatever. makes more sense than ""evs"" because the word ""whatever"" does not have an ""r"" in it."
"evv","Evvs","an abbriviation of the word whatevvs meaning whatever, used by idiotic lazy people who can't just say whatever, or even whatevvs."
"ewl","Ewls","a ewl is a large beast which mainly consumes petrol and oil but there are some with diets made up from human waste (rubbish). some adult ewls can way many tones and young ones when they hatch can sometimes be grams, a baby ewl is called a dinky in some countrys. even though some ewls are magnificent and are put in awsome shows, it doesnt mean these beasts are not extremly dangerous (because they are) ewls account for all fatal road fatalities in the world alone! a ewl will lay eggs after a buck ewl and a doe ewl mate, the femle (darbage ewl) will lay her eggs in a tip.

p.s the darbage ewl is just one of many ewl spiecies and not all ewls share the same breading grounds.

the first ewl was discovered early in the 1900s and since then many new species have been found, more species are still being found today."
"ewn","Ewn'","a typo of the word 'own' in which the typist is typing on a dvorak keyboard instead of the traditional qwerty.

the words 'pwn' and 'pwned' became very popular ""leet"" ways of exclaiming how one has bested an opponent in some manner on the internet. this is due to the fact that 'pwn' is a typo of the word 'own' where the typist accidentally typed the letter 'p' instead of 'o' due to the 'p's placement to the right of the 'o' on the qwerty keyboard.

similarly, if one were to type the letter directly to the right of 'o' on a dvorak keyboard, the resulting letter would be an 'e'. thus the typo 'ewn' is born.

most likely never an actual typo, rather a purposeful mistake used to make people ask the typist how they could have typed 'ewn' when they meant 'own' thus allowing the typist to go into an explanation as to why they use the dvorak keyboard. this, in most cases, will make the dvorak typist feel very smug and superior."
"ewp","Ewps","sentiments uttered after an accidentally dirty predicament: oops + ew = ewps."
"eww","Eww'","the word 'eww' is often used to phrase a sentence with disguist."
"exo","Exo-K","a group of 12 gods from exo planet, divided into exo-k (korean) and exo-m (chinese). exo-k consists of: dance machine kai, sexy maknae sehun, water bending guardian suho, derp chanyeollie, kyungso_o, and snsd fanboy baekhyun. exo-m consists of: meat bun xiumin, healing unicorn yixing, bitch-faced dragon kris, wushu/aegyo master gucci tao, lost-in-translation chen, and the youngest is 5 y.o luhan a.k.a marilyn monroe. members currently in a relationship are: kris & tao, sehun & luhan, kai & suho, and chanyeol & baekhyun. their unofficial fandom name is exotic and they are on crack. exotics usually 'pedo-noona' over members when in reality most of them are dongsaengs in high school. they stay up until 4am to watch live streaming interviews that exo guests, while reading translations on their tumblr dashboards. once you become an exotic there is no turning back. no cure is known for this disease except for contant song-replaying, photoshoot-photo-reblogging, spazzing, and fan-fiction-writing."
"exy","Exy","combination of ""ex"" and ""sexy""  adjective for a boyfriend or girlfriend that is technically an ""ex"" buy still vaguely romantically involved with you (thus somewhat sexy)."
"eya","Eyas","eyas /iya:s/ - (noun) - an old bosnian word for: ""god's gift to women"". the word used by fathers to tell their sons that if they want to become eyas they must be confident and bold in life."
"eye","Eyes","eyes (n.) - traditionally defined as a feature on a living creature’s body that allows it to see, this simple area of the body is considered by some to be the most beautiful and mystifying physical feature of another person (especially the eyes of a woman).  unlike the [breasts], [legs], or [gluteus maximus] (which are often associated with physical beauty in women) the eyes hold value outside of the realm of sexuality.  (some would even argue that, for this reason alone, the admiration of a woman's eyes is more respectable and pure than being physically attracted toward some element of her sex.) some men find the most dazzling feature of a woman to be her eyes, leaving everything else as all but completely irrelevant.  looking into a woman’s eyes, one can sometimes peer into her soul."
"eyo","Eyo","shoutout to someone...beginning a conversation...""eyo, wuttup"". calling a friend to attention.  eyo (hey you)"
"ezy","Ezy","her fear are caterpillars, she loves hedgehogs, she has an awesome ""brother"" charwene, golf is her hobby, yan yans (you're welcome) are yummy, green is her fav, ezy pezy the pineaple, have a nice day. :)"
"faj","Faj","a word you call somebody who pisses you off or is very annoying. very similar to -fag- but is more ""appropriate"" when out in public. a faj is someone who can't take a joke, is annoying, whines all the time, and pretty much anything you want it to be. faj can be used in place of words that you may forget how to pronounce and is a fun word to joke around with. you can use faj however you like. everything is faj. the world revolves around the word faj."
"fat","Fat","""fat"" is a term that is being used more and more often now days. this word is being thrown around lightly. fat, or obese, means to be over sized, or enlarged. hollywood portrays that any woman over 100 pounds is ""fat"".  genetics, stress levels, work habits, etc can effect a persons weight. not all ""fat"" people can help how big they are. sure they can increase exercize habits, and eat healthier, but that does not always mean they will get thin. && anybody who uses this word as an insult, is a hateful human being."
"fax","Fax","a. a slang word with two meanings. i. a hot person ii. a situation, event or occurrence that is pleasing. b) anything that isn't fax is defax."
"fay","Fairy","another word for a fairy (faerie, fairie, faery). the fay (fey, fae) also include elves, sprites, pixies, brownies, mermaids, dryads, imps, nymphs, and other small mythical creatures."
"faz","Fazio","the coolest nickname anyone could ask for.  it holds the cool status of the ""fonz"" with the italian twist from fazio."
"fbq","Fbq-","fbq- facebook quote. to quote someone on facebook"
"fbz","Fbz","fbz stands for federal bureau of zion, its been in existance since 2002 and is based out of commack long island. its members are made of the realist kids u will ever know. if you think you are living your life, your are wrong, the fbz controls everything and everyone. our members span the country from simple civilians to major celebrities such as george lucas, partick warburton, dane cook, karl malone and many others. the founding members are jay and rory. fbz takes shots, but not from guns."
"fck","Fuck","it means [fuck], used in [chatbox]es or [webboard]s (bbs) where ""fuck"" is [censor]ed."
"fco","Fcos","fcos is short for “of course”, chat-wize."
"fcz","Fcz'","when you live in the czech republic (cz) and then you live in the usa for while and return to the cz and it's no longer the 'cz', it's now the 'fcz' because it fucking suck."
"fdx","Fdx","diminuitive of the term [foda-se]. a portuguese native word, meaning [fuck] it.  fdx was adapted for the internet, just like many other words. for fast typing, the portuguese community started to type it ""fdx"". and that is how it began."
"fea","Fea","fea can be used as an endearing expression to refer to a girl. it literally means ugly, but when someone is beautiful and you call them fea, it is culturally acceptable- as a tease."
"feg","Feg-","feg- noun- a generally unattractive, pale-skinned female who has no social life whatsoever. has tendencies to try to fit in with others, but fails miserably.  her attitude is always the same, no matter what the situation, and she has the habit of butting into conversations that she was not invited into.  feg is also a know-it-all who looks to outdo anyone in any academic subject, all the time. she has the annoying habit of always scoring at least one point higher than anyone else on a given assignment, and if -in the rare case- she is not the tip top, to her, it is the end of the world.  feg also enjoys coasters.  feg- verb.- to feg something up can also mean to totally take the enjoyment and life out of a situation or activity. the action has been known to compromise social lives, and can lead to an early death."
"fen","Fence","short for [fence]. it has been used most recently by cool kids on the east coast and in the midwestern us, but is believed to have originated in the sanfran area"
"fer","Ffer","to forget, to reject an offer"
"fez","Fez","a fez is another name for a condom. kind of like a fez but for your other head."
"fgr","Fgr'S","a slang term on facebook for ""faggot""; which came into use after the fgr's at facebook started issuing temp bans for typing out the full word ""faggot"" in response to general faggotry from some faggots."
"fid","Fids","the word ""fids"" comes from the word ""kids"" the ""f"" means feathered. its a word that bird owners will use, usually the more advanced owners."
"fif","Fifth","fif: means to plead the fifth amendment; to not tell something to someone else because of whatever circumstances.  in the superlative, fif can be written as ""fizzif"""
"fik","F.Ik","fik or f.ik or f.i.k (for those who are extra ocd) is an acronym for sms which stands for ""fuck i know"". usually used when a surprise element precedes the usage of fik."
"fin","Fins","adjective used to describe one with an outstanding personality.

‘fins’ are thoughtful, charming, handsome and incredibly helpful. they are also known for being exceptionally intelligent, and always giving good company.

they generally prefer the night.

'fins' take advantage of those who just don't get sarcasm :l"
"fit","F'It","f'it or fit is a contraction of the words fuck it. used by people who say they don't swear but still use a word to replace the ""swear word""."
"fix","Fixed","the proper term for a single gear fixed wheel bicycle. these bikes were traditionally home made by the users; they would take a traditional 10 speed frame toss out the hanging derailleur and remove the 5 speed fly wheel and replace it with a single speed ""fixed"" hub. these bikes were most popular among nyc bike messengers in the 70's, 80s, and early 90's because of their low maintenance and lighter weight; many users would have only a front brake or forgo brakes totally because you can control the bikes momentum solely suing your feet. these bikes were not for the lazy or lighthearted because they require a much more skilful and alert riding style as well as perpetual motion because the is no ""free"" spin mode.

the fix could be brought out right in those days at some bike stores by asking for a racing bike. racing bikes were usually made by bianchi or lotus and sported rear facing dropouts for the back wheel; these store bought fix bikes were uncommon for the average fix rider and primarily purchased by bike messengers.

the majority of serous road bike riders, then and now, use geared bikes.

today people are calling bikes like this ""fixies""; there was no such term ( fixie ) being used on the streets in 1970's thru early 90's. fixie should be used to describe store bought bicycles many of which do not even have fixed flywheels."
"fla","Flah","verb: sexual intercourse noun: an attractive person

a slang expression used in cork city, ireland.

also spelt flah."
"fli","Flis","flis, a word describing an extremly gay person.......who likes to run naked through eating establishments."
"flo","Floor","the floor. typically a floor in the hood or in jail."
"fmu","Fmu-","fmu- fuck me up"
"fmx","Fmx","fmx or freestyle motocross is a fast growing sport and is pushing the envelope on insanity. it consists on modified (usually two stroke dirt bikes)bikes that have been talored to perform air born tricks. the front and rear fenders are cut shorter so that nothing on the rider gets caught on the bike. the air box covers are cut out larger for a grab hole, for when the rider needs to grab under the seat to do a superman seat grab and other tricks that require a grab hole. the handle bars are replaced with a low setting bar that has no second bar for support. this bar offers more room for throughing the feet out over or through the bar for tricks like the bar hop. fmx riders usually hit wood or meatl ramps called kicker ramps. they are described by their height. 6' kicker or an 8' kicker. the landings are usually dirt but can be a metal landing ramp/trailer. the kicker ramps are good from about 30-70ft gaps. the riders compete in a timed session, they through out the sickest tricks with consistance and skill to impress the judges for the highest score. the sport came from a side show entertainment for motocross riders to make a little extra cash, to a highly competitive, extreme sport. fmx has come a long way from simple no footers, no handers to double backflips, 360 backflip, and with all kind of trick variations while flipping. keep in mind this is on a 250lb motorcycle."
"fni","Fnis","fnis derived from a country in europe called denmark. first spotted on the streets in madison, wisconsin early in 2005. used as a noun. somewhat like a [dime]. only the pimpest of players use this term. see also... [hottie] - [dime]"
"fob","Fob'S","first of all...fob's are immigrants a.k.a. fresh off the boat. there are many kinds of fobs (i cant really take credit for this becuz i got this off a site. i added some in)  twinkie - besides your nationality, there is little to distinguish you from white people - your significant other is not asian and never has been - you have few asian friends, if any - you are embarrassed at family events because you cannot speak your language and everyone has to switch to english to communicate with you - you have no idea that the other types of asians on this list even exist - you think hello kitty is dumb and do not know what sanrio is - you are the only asian on this list that does not know what bubble tea is - you drive a ford or some other domestic car and if you drive a honda, it is stock  asian-american - you claim yourself as asian, but real asians think you're whitewashed and non-asians see you as a foreigner. you fit in nowhere - you have heard of bubble tea but have never actually had any - you are confused about your cultural identity and express this frustration through spoken word performances at your college - you read a. magazine and think it's great - you do not know who leon, aaron, sammi, hikki, or kangta are - you are only vaguely aware of the other asians below  yap (young asian professional) - you are in one of these professions:   a) medicine / pharmaceutical   b) engineering   c) finance   d) investment banking   e) accounting - most of your wardrobe was purchased at banana republic - you go to ""mixers"" on thursday nights to meet other yaps and talk about the dow jones. - you did exactly what your parents wanted you to do and as a result, your life is hella boring - your apartment/home is decorated almost exclusively with stuff from pier 1 - your parents always talk to their friends about how much money you make. if they don't, then you're a dissapointment  fob (fresh off tha boat) - you were not born in america - you know who leon, aaron, sammi, hikki, and kangta are. in fact, you have seen them at atlantic city or las vegas recently - you speak your native language fluently and so do all your friends - you do not have any non-asian friends - your parents do not speak any english - when you speak english, you like to make everything plural - you get extremely good grades in school - you cannot dance - your fashion sense comes from whatever country you're from and you incorporate nothing from american fashion into your wardrobe  superfob - your command of the english language is minimal and you don't care - you like dim sum chicken feet - you do not own a single cd, vcd, video game, or dvd that isn't bootlegged - your only hangout is chinatown - all the lights in your house are fluorescent - you dry your cloths outside your window - you need a haircut - you either smell like cigarettes or food  fobabee - you are an asian-american or twinkie who has recently ""awoken""  - you have a newly found fetish of asian girls/boys - you have taken the asian studies course at college - you are trying to learn as much as possible about your culture to make up for your lifetime of trying to be white (twinkie ; banana) or black (chigger ; tea egg) - if you are lucky, you will grow to become fobulous  gangsta fob (fobsta) - you have shot another asian - your favorite hangout is a pool hall - when you talk, you sound like a cross between a fob and an urban black kid - your hair looks silly, but no one will tell you because you'll shoot them - you have a serious gambling problem - you are a rice-boy, but your mods are cheap and are never painted to match the rest of your car - no one tells you your rice ride looks cheap because you'll shoot them - you want to have a tab girlfriend, but can only get hoochie tabs  tab (trendy asian b*tch) - you shop at a/x, bebe and club monaco - you only wear black and will occasionally wear white to ""mix it up"" - you do not weigh more than 105 lbs - you have never paid for dinner at a restaurant in your life - platform heels are your favorite - you are a makeup expert, in fact, you appear completely flawless - you do not smile in public - you are the object of desire of all asian men and you know it - you smoke - your cell phone is completely customized - on the inside flip of your cell phone is a sticker pic of you and your man - somewhere in your purse is a sanrio item - you only date asian and will only date a boy with a nice car - you are often seen with rice-boys - you never travel alone. you are either in the company of other tabs or your rice-boy boyfriend  hoochie tab - you are an import car model - your boobs are not real  - there are naked pictures of you floating around on the internet somewhere - stiletto heels are your favorite - your role models are francine dee and kaila yu - your boyfriend is a gangsta fob - you cheat on your boyfriend - unlike most asians, you do not do well in school  rice-boy - you drive an asian import. usually a honda or acura - your souped up car (known as a rice-ride or rice-rocket) is unrecognizable from it's original stock form - your exhaust pipe is big enough for your head to fit in - the spoiler on your car looks like it was made by boeing - the interior of your car also looks like it was designed by boeing - you always drive like you are racing someone - you are not afraid of dying in a crash, but you are afraid of speed bumps and parking lot on-ramps - the only other person besides yourself who can sit in your car is your 105 lbs tab girlfriend. if anyone else sits in your car, the entire bottom of it will be touching the ground - even though your car is a honda, it goes faster and is worth more than a lotus esprit - if you drive a civic, your dream car is a supra. if you drive a supra, your dream car is a skyline (which you can never have). poor rice-boy.  fobulous - you speak perfect english and you are fluent in your native language - you have asian friends as well as non-asian friends - you listen to asian pop as well as american music - you are equally aware of both popular american culture and asian pop culture - you are a good dancer - you date asian by choice even though you could rock the opposite sex of any other race  - you are a good designer and have superior html skills - you have an apt107 page and an aa page and the guest books in both are packed - for you, fob stands for fabulous oriental being - you have lots of asian pride  pob  - a filipino fob. - words that start with f tend to be pronounced with a p. (fuck you..pobarized version: puck you)  - full accent"
"foo","Fool'","a contracted version of the word 'fool'.  the word origionated with mr.t. due to the extended contact with cheap substitute gold, he can no longer tell the difference between anybody he meets. in order to save himself the humiliation of asking who he's talking to, he simply refers to anyone and every one as 'foo' or 'sucka'. "
"foq","F O Q","f o q = fuck off quickly  to leave the place that you dont want to be while you have the chance.  usally used so other people are unsupecting of what you will be planning to do.   can be followed by a eye whink."
"fox","Foxy","a term used to describe someone thought of as very attractive/sexy. can be used for males or females. see also [foxy] for adjective form."
"foy","Foy","foy is actually a term for the smell that accumulates between a mans balls and his arsehole, as in [gringo's arse] and foy smell.  it is an unusual musty smell that is surprisingly hard to rid despite a decent personal hygiene regime.  often associated with physical activity and sport."
"fpe","Fpe","the fpe are a highly regarded street gang from the mean streets of furze platt maidenhead, the name derives form them being an elitist group therefore fpe becomes furze platt elite, the fppe is the group for the female counterpart known as the furze platt pimpettes elite, the pimpettes of the seemingly pimpish members of the fpe. the fpe consists of wayne, david aka fish, alk aka alkster and adam aka irish pimp "
"fre","Fresh","a hip way to say [fresh]. something fun/exciting that hasn't been done before."
"fry","Fry","actually, to point out to you above me, fry didn't fall into the freezing machine, but he was pushed (litterally blown) into the machine by nibbler (leela's pet who is actually an alien sent back in time to have fry save the world from the evil brains ""insane in the membrain"" is quoted from one brain as they were in the gaint memory bank from the brain.)"
"fsd","F.S.D","f- fake s- scene d- dome  this is typically, but not always a girl who is; 1. fake (hair-dye, bape loving, pot smoking, i go to concerts to look cool, and such) 2. ""scence"" (i like to hang out with guys who are in bands, i listen to screamo music, and wear a ton of band tee's) and 3. like to give dome (dome meaning head).  other types of people like this could also be known as a groupie.  f.s.d. people have no life and can be seen at every party, playing beer pong, and attempting to break up relationships.  be cautious, these people carry s.t.d.'s."
"fua","Fua","comes from the mexican ""fua philosphy"". the extra power you need to do something. the character and strength that projects to the universe and gives the extra power you need.

you´re tired? fua! you´re sad? fua! you´re sick? fua! someone´s dead and you want to revive him? fua!

no more ugly moments... live by the fua philosophy."
"fug","Fugly","short for ""fugly"", or ""fuckin' ugly""."
"fuj","Fuj","the excretion of a mucus-like substance from any orifice of the mammalian genus. fuj can be numbered by orifice starting from the top of the head down (i.e. - 1 (left-eye), 2 (right-eye), 3 (left nostril), 4 (right nostril), 5 (left ear), 6 (right ear), 7 (mouth), 8 (left nipple), 9 (right nipple), 10 (genitalia), 11 (anal)...and if there are multiple fuj references they must be separated either by comma unless their are sequential order.   if there are conjoined twins then designation between twins must be used by a ""."". example: 2.1.7 (2=conjoined twin, 1=left twin, 7=mouth)  additional spellings: fuj (ed, ing, -like, er, ee, ilation, s/es)"
"fuk","Fuck","like ""fuck"" but with more emphasis"
"fum","Fum","chum is fum. also, fum is chum. krabby patties may also be fum. coined from the television series, spongebob squarepants."
"fut","Fut","fut, an exclamatory term to describe nearly anything, or simply as an exclamation.

not a substitute for the eff-word.

can be used to get attention from friends or others, can be said; fut, futting, fut-uh, mmmmmmmmmmmfut."
"fux","Fuxer","a wild card. to the untrained fuxer, it seems to mean a shortened form of the word ""fuck"" or ""fucks"". but to the trained fuxer, the word fux, can fux anything. it is truly a fux card and you can fux anything with it."
"fwn","Fwn","in either internet shorthand or text, fwn can be a shortened version of the word ""phone,"" by taking the ""ph"" sound of phone and subbing it with a ""f,"" and then taking ""own"" sound from the term ""pwn,"" and combining it with the ""f"" phone = fone own = pwn = -wn f-one + wn = fwn fwn and phone are pronouced the same way."
"fye","Fye","an adjective that can describe either a person or a thing that one greatly approves of.  originating from the south, the term fye is simply the word ""fire"" with a heavy southern accent added. ""fye"" and ""fire"" can be used interchangeably as adjectives in this sense, depending on the preference of the speaker.  see: [hot]"
"gad","Gad","""gad"" is the name of a false deity mentioned in isaiah 65:11.  ironically, the hebrew name ""gad"" does not rhyme with ""sad"" or ""glad"", rather it is pronounced exactly the same as ""god"".  yahweh is nowhere called ""god"" in the hebrew or greek, but, most english-speaking people seem to prefer this substitute instead of his real name. "
"gai","Gai","in the country of thailand, the thai word ""gai"" means chicken. so if you are ordering [thai] food, just get the gai; its good. ;)"
