"rio","Rio","""rio"" the most awesome person in the world. if you don't like a person named rio, no one likes you. "
"riv","River","the stikine river in the alexander archipelago of southeast alaska. the river originates in british columbia, canada and opens near wrangell, alaska. the river is popular with locals in alaska and canada, frequently among young adults pursuing intoxication and heightened states of awareness."
"rkt","Rket","on-line game term used in game play when playing against another human player or in [co-op] play. means ""[wrecked]"" in the game and was mainly used in [warcraft] 2 bne edition & later used in fps games like [soldier of fortune] 2/modern warfare 2. later the term became used in [mmorp] games and there it became used only by those who played the older games and remember it. the younger players put a ""e"" in it becoming ""[rket]"", which makes no sense to anyone that knows what ""short-hand"" is all about and rkt is not only shorter then rket, but who put a vowel in short-hand if there is no need??"
"rld","Rlds","the reformed church of jesus christ of latter day saints. rlds is an offshoot of the official mormon church which split off after the death of joseph smith.

nowadays they prefer to use the title 'community of christ'

brigham young took the official lds church to utah where they carried on with their practice of polygamy until about 1890

the smaller rlds - along with joseph smith's wife - did not approve of polygamy and has never practised it

not to be confused with flds which was a later split - in utah - of mormons who wanted to carry on polygamy,y after the 1890 official lds ban"
"rlz","Rulez","""rlz"" mean rulez (rules, rule)"
"rmx","Remix","otherwise known as the ""remix"""
"rnb","Rnb","rhythm and blues. a style of music denotable by its bluesy guitar sounds and deep vocalising, that dates back to about the 1930s. nowadays the phrase rnb has been coined by slow rap music, where the actual phrase rhythm and blues is no londer relevant. a general feeling that moaning about someones make believe situations counts as blues, whereas genuine rnb was started during the derpression in america, where the blues were a reflection of human uncertaintey and not the modern day idea of rnb (i.e. flashing money and cars and women and whining about girls)"
"rny","Rny","pronounced like ""ernie."" it means really horny, but taking it to another level- horny to the point you exclaim it out loud but no one really knows exactly what your talking about so it makes it ok to do it!"
"rob","Rob","a boy named rob is one that goes out of their way for other people without asking anything in return and exceedingly kind, gentle and cute. he is exceptionally intelligent, but doesn't let anyone know about his grades unless he is asked. he is often shy around girls, especially if he has feelings for her, but is too afraid to ask them out because of messing up. rob is also a born leader, exceptional at decision making, and is not afraid to take charge of a bad situation should one erupt."
"rog","Rog","a ""rog"" is someone who doesn't like brews. ""rog"" is defined as ""a single individual committing an act of nultonry at a certain time or in a certain place."" this can be explained through such behavior which includes hatred for: the taste of brews, the drinking of brews, the loving of brews, being intoxicated, etc.. sometimes you can witness a ""team rog,"" though rarely observed in nature...it is defined as, ""two or more people engaging in an act of nultonry at a certain time or in a certain place."" reference the facebook group: ""i love brews!"""
"roj","Roj","[masculine], [defender], [lover], [fighter], [warrior]. always fighting the [good] fight if you're a man he can be your best [friend] or your worst nightmare. if your a woman, wrap your arms and legs around him and hold on [tight]! roj is an amazing lover (absolutely gifted in bed)....if you've got a roj in your life, don't ever loose him!"
"rok","Rock","slang for [rock], but more specific for expressing joy, enthusiasm, and excitement.   "
"rom","Ronym","1) acronym for read only memory 2) a big sized file that, when loaded into a console emulator, plays a video game that's usually licensed"
"ron","Rong","strong, protector, lover, fighter, warrior. stay on thier good side! if your a man he can be your best friend or your worst nightmare. if your a woman, wrap your arms and legs around him and hold on tight! if he is ambivilent towards you, embrace the fact that you are probably a loser"
"rou","R.O.U","r.o.u.s's are rodents of unusual size. it comes from the 1980's movie princes bride, in the fire swamp scene where buttercup and wesley encounter the rous's. the rodents are about the size of a large dog."
"rox","Rox","another spelling of the word ""rocks.""  rox is a shorter and sometimes cooler version of ""rocks."" rox=rocks"
"roy","Roy_","(noun)

1. a male given name. also little known peanuts character introduced in 1965, and was the best friend of peppermint patty (source:en.wikipedia.org/wiki/roy_%28peanuts%29#roy)

2. generally a name for a virile and attractive male, could possibly be a fire sign..like an aries. has a tendency to be stalked by older, unattractive, short women. prone to being cockblocked. has a hard time saying no when necessary so may also be prone to ""bad"" touches and unnecessary roughness from short, hairy and detestable females when he's really dying inside at the thought. (think ace ventura and the shower and plunger scene)"
"rsa","Rsa-","rsa- rancid stank ass"
"rti","R.T.I","r.t.i.

acronym reward the idiot primarily used in poker, specifically no limit holdem but can be used in all walks of life. anyone who gets rewarded for being an idiot. happens quite frequently and is a global phenomenon."
"rtn","R.T.N","r.t.n. stands for respect this nigga. abreveated for texts or bullitens. you can use this when youwant some one to be respected, even ur self."
"ruf","Rufs","rufs is short for ""r u fuckin serious?!"" used for those occasions when ""are you serious"" is just not enough to question the seriousness of a situation."
"ruk","R U K","phrase for are you okay? (r u k)"
"rum","Rum","a verrrryyyyy tasty alcoholic beverage recomendation: appleton rum (jamaican rum)"
"run","Runs","really bad diarrhea   they call it the runs because you gots to ""runs"" to the washroom before the shit ""runs"" out of your anus and down your pants (assuming your wearing pants)"
"ruq","Ruq'S","a large though easily subdued being known for living in a soft glow, said to be the reflecting of hentai porn on it's glasses. when asked as question non-relating to sega or nintendo, the ruq will often respond with ""buh"". some believe transformers are another way of a ruq's ""pleasure"". does not take kindly to timbits."
"rus","Rious","are you serious."
"rvc","Rvc'S","rvc is an acronym for ""racist vagina (spider) crab""  one of the worst known std's, rvc's grow in hosts based on relative bitchiness. the bigger the bitch, the worse the case of rvc.  males must be wary if a female has rvc, for anything entering a host vagina will be consumed in it's entirety. mexicans and blacks will simply be spat out intact because the crab believes that only whites are worthy of being consumed."
"rvy","Rvy","rvy stand for ""ram a vagina yesterday""

man 1: ""i rvy kimmie in the ally"" man 2: ""damn son! i rvy her too!"" man 3: ""me too!:"
"rwd","R.W.D","r.w.d. term meaning rear wheel drive, opposite of [fwd]. usually results in better weight distribution and improved handling for the vehicle because the whole drivetrain is not cramped towards the front.  also means that as the vehicle accelerates and the weight shifts to the back, traction improves. contrast this with [fwd] where the weight shifts off the front wheels causing spectacular yet idiotic burnouts."
"ryd","Ryd","suburb in west linköping, sweden. during the constant gang war with the real tough hoods, like ryd and valla, ryd has retained nothing more than a shadow of it's former glory.  in ryd, most inhabitans are students that are too weak to last in a street fight. they once had a mcdonalds, but it was burnt down in the gang war."
"rye","Ryone","new york's version of the oc.  there's wealth, there's drama & everyone is hot and well dressed. everyone 14 and up is basically perpetually drunk every weekend and summer.  if you live in rye, chances are you are: blonde & blue eyed, pop ur collar, are extremely preppy, think that playland is the trashy home to ur gardeners, play beirut every weekend, a border-line alcoholic and know have atleast three friends with a bmw.  screw the oc, rye is the place to party!"
"ryn","Ryn","origin; orlando,1998. meaning: derived from jason kocan's caller id that read...caryn; at which time the birth of ""ryn"" was born. 2) ryn, inc.; resources you need, inc."
"ryo","Ryo","ryo is known for cybering the most girls on irc. ryo is a legend."
"ryu","Ryu","that martial arts guy from [street fighter] who always beats up his friend ken in every game.  ryu also enjoys picking fights with poor innocent dictators, demon-possessed martial-artists, and sorcerers, who are all just trying to make their way in the world.  apparently, ryu also has a schoolgirl fetish, which explains why that sakura babe keeps following him around since street fighter alpha 2. "
"sar","Sars","a disease that is not a significant threat to the health of the worlds population.  more people die of the common cold every day than die from sars.  the media saw sars as a cheap way to boost ratings during the time just before sweeps week in order to build up a strong viewer base.  it was conveniently reported at the same time that we were bombing iraq into oblivion.  hmmmmmm,,, isn't it interesting how things just happen to pop up when bush needs the country's attention focused elsewhere while he's busy raping the world........"
"sau","Saus","saus can be used for many purposes.  1.) to tell someone one to fuck off. ""get saused""  2.) when you dont want to go somewhere billy: ""hey man want to come to my mum's for dinner"" jimmy: ""nah, saus""  3.) giving a rating to something adam: ""what do you think of this subject?"" justin: ""it's saus"""
"say","Says","the term ""says"", originating in south-western sydney as an accidental synonym to ""days"", is considered to be an informal replacement to ""days"" by the estonian army whilst at war."
"sbn","Sbian","text talk for lesbian."
"sch","Schm-","works well in degraging a name in a simple ryhme..   often used is schm-"
"sco","Sco","a sco is a horrible person who takes things from people, while asking, but then dosn't wait for a response. you know a sco."
"sdm","S.D.M","s.d.m.= self destruct mode

usually you will be intoxicated before going into s.d.m., however sometimes you can go into s.d.m. while not under the influence. sdm usually happens when you are in a club or party and it is near the end and u have been turned down by all the decent girls... at this point you will go into sdm and go after anything with a punani, some girl you would never imagine picking up in your right mind."
"sdt","Sdt-","sdt- an acronym meaning 'sexually deprived teenagers"""
"sej","Sej","to be utterly ridiculous beyond reason. sometimes used as a verb when shooting tequila like a maniac.  also refers to someone to whom the party cannot happen without; a sej is the ultimate party girl.  sej is sometimes used to refer to a ""saucy energetic jew."" "
"sek","Sek","[scene]/[emo] kid.   1. a sek is most commonly seen at open mics and small, underground shows. a sek is most commonly male. he is normally seen with a group of girls wearing mini-skirts over spandex leggings, which are usually cut mid-calf. if you're lucky, you'll see a sek wearing colossal white-rimmed sunglasses and little hair barrettes. a sek always wears stylish pants. a vast majority of the sek population rocks the chick-pants. seks vary in personality, so even though they dress like most everyone else on myspace, you should probably try to be friends with them. "
"ser","Se-R","a trim level for nissan cars with sporting flavor.  original se-r was the 91-94(b13) sentra's, an inconspicuous pocket rocket powered by the venerable sr20de engine, sporty suspension tuning, a driver oriented interior and subtle exterior enhancements.  good definition of a ""sleeper"""
"set","Sets","another way of using the term clique. sets are hand signs or words used to represent your hood, friends, etc."
"sex","Sex","a painful activity in which a man, using the stiffest and pointiest part of his pelvic region, repeatedly stabs a female in her crotch until he feels satisfied.  can also take place between two men, in which one male stabs the other in the bum.  lesbian ""sex"" may be fun and all, but it aint real sex unless there is some sort of stabbling going on, perhaps with a cleverly shaped hand or steel dildo."
"sgo","S Go","a shortened version of ""let's go"""
"shc","Shc-","-shc- the term used for the short form of ""shadow hunters clan"" -a clan of bounty hunters that started off on a guild on neopets. bounties placed shall be taken care of by head hunters or other shadow hunters.  -also has a proboard website. -roleplay clan "
"she","She","the common target used in the jokes ""that's what she said"". she is commonly refered to as a whore, slut, or any other name for a sexual dirtbag, seeing as she is normally saying something that refers to something that could happen during sexual intercourse."
"shi","Shit","short form for ""shit"".  can only be used as an exclamation.  when using shit as a noun, the final ""t"" must be pronounced."
"shl","S.H.L","s.h.l - single hit listener: someone who only listens to  popular single tracks from artists! "
"sht","Shit","1. a censored version of the word [shit]. often used on web forums or chat rooms to avoid swearing filters.  2. a dismissal of given rumour or gossip, much the same as [bullshit], made for use on a virtual enviroment."
"shy","Shy","trait to like 1.2 % of americans. if your shy in anyway you are considered an alien from outerspace, which is really fucking ridiculous since the trends of current america would make anyone shy. most people in this country are loud and overly extroverted. girls are too hard on shy guys. girls shouldn't care if a guy is shy. when a girl is shy it's cool and when a guy is shy it's considered really uncool that's dumb as shit. "
"sic","Sic'","square brackets are most commonly used around the word 'sic' (from the latin 'sicut', meaning 'just as'), to explain the status of an apparent mistake.  generally, sic means the foregoing mistake (or apparent mistake) was made by the writer/speaker i am quoting; i am but the faithful messenger; in fact i never get anything wrong myself.  book reviewers in particular adore to use sic.  it makes them feel terrific, because what it means is that they've spotted this apparent mistake, thank you, so there is no point in writing in.  however, there are distinctions within sic: it can signify two different things:  1) this isn't a mistake, actually, it just looks like one to the casual eye. 2) tee hee, what a dreadful error! but it would be dishonest of me to correct it.  ~ from 'eats, shoots and leaves' by lynne truss"
"sid","Sid","epicness. win, something good. other name for playboy succes. almost all girls love the sid, however, because a sid is someone in great power they might be afraid to say hi. but a sid loves girls and will always be willing to have a nice time with them. sid is also a male name, shortened from [sidney], which is a [unisex] name.

how to find a sid:

1. a sid is someone that is very intelligent.

2. a sid sit in a great position of power.

3. sid loves girls, and are often not afraid to say hello or flirt.

4. a sid might not be strong (just average, or less - more) but he is perfect with computers. might not play games all day.

5. he easily makes the girl he wants fall in love with him. easily.

6. people obey him and he's very popular. he doesn't need to wear cool clothes because we all know he is the best anyways.

7. he is perfect in bed.

8. not homosexual.

9. a sid often does ironic jokes about himself, not to be confused he is just joking.

10. sid loves girls asses... so if you, ladies, are trying to flirt with a sid, please style with your ass for him.

11. sid loves hugs and kisses. from females, of course."
"sik","Sick","interesting, cool, new. (variant of sick)"
"sim","Sims","a ""god"" game, that is played usually on the computer. which involves, creating a charcter and developing thier life, according to what you want them to do. you decide everything about their life, family, job, appreance etc. it is a game that is often considerd to be girly and dumb, but is quite addictive. the original version, has no point other than goals that you may set for yourself, where as the version on consoles, or the  sims 2, has a point to the game, and in game goals for you to meet, to create that oh so perfect life."
"sip","S.I.P","s.i.p.  means  smile in peace  it's the short illuminated art version of saying r.i.p. (_rest in peace_)  "
"siv","Sieve","actually spelt sieve  a sieve is actually a filter with many holes used for strainging water and liquid from something. the chant is directed to the goalie to say that he/she lets up a lot of goals because he/she is a sieve and contains many holes.  in other words...the goalie sucks"
"six","Sixes","this is any car in mercedes' top-of-the-line 600 series...no matter what anyone tells you, it is not a car with a v6 engine. rappers rap about driving sixes; my grandmother's buick has a v6...which makes more sense here?"
"ska","Ska","one of the most versitile and long lasting genre of music alive today. disregarding some peoples beliefs, ska makes itself individualised by its brass section, walking basslines and offbeat guitar chords. there were 3 waves of ska; trad, 2 tone and 3rd wave but most bands today are 3rd wave caus its totally cool. it has derived from alot of influences, of which jazz, reggae, swing and punk would be the most prominant. suits, big shades and dancin' shoes are usually worn at a ska concert."
"ski","Ski","this is to be occasionally placed at the end of a word (usually while intoxicated) possibly indicating a sense of excitement about the said word. it can also be added to the end of a person's name, indicating their level of [coolness]. the addition of more than one ""-ski"" indicates that the person is more cool than that of a person with only one ""-ski"". however, adding too many ""-ski's"" to the end of a word indicates a level of retardation on behalf of the speaker. ""-ski's"" are best used in moderation."
"skl","Skl'","'skl' is short for 'skool' which is short for 'school'."
"sks","S.K.S","crip gang found and ruled in westminster, ca. by samoans, blaccs, hispanics and italians in 1982! s.k.s stands for ""some krazy shitt!"" originally ""samoan krook style"" until integrated in 1985! constantly whooping the asses of other local sets for recreational purposes, even when outnumbered!"
"slk","Slk32","a two door hot ass roadster made by mercedes benz. with many different engines available. sports package was an option, also referred to as the amg package. not to be confused with the slk32 because that whole car is amg. but any package or engine will make you look 10 times sexier behind the wheel. guy or girl. if its an slk your looking slik. the only drawback is you cant fit more then one girl in the car safely. "
"slt","Salut","short for salut (french for hello), used especially in chat rooms, irc etc."
"slu","Slut","word meant to mean the same as slut but can be used when the sluts are around!"
"sly","Ssly","so like when i'm imagining ""sly"" i just see a real slick looking dude just posted up against a suspicious building under a shadow.. zoom in and the fucker has a tooth pick in his mouth just so effortlessly sweet"
"smc","Smc'","yet another addition to the never ending amount of annoying internet acronyms, 'smc' means 'suck my cock'."
"smk","Smoke","literal (smoke)

someone who doesn't smoke in the same room or apartment where their computer is might type this in conjunction with brb to indicate that they're breaking from whatever online interaction they having with another person or persons over the internet for at least the duration of time it takes them to smoke a cigarette. ~ 4-10min."
"smm","S.M.M","s.m.m. or $.m.m.   sex, money, murda is a neighborhood-based street organization that originated in the soundview section of the bronx, new york. more specifically, the gang was fathered by peter rollack a.k.a. pistol pete from the soundview houses, a low income public housing development managed by the nycha. pistol pete is now serving a life sentence without parole on a plea bargain for killing and committing to kill 6 people. s.m.m. eventually affiliated itself with the united blood nation which emerged during the 1990s. over a relatively short time the s.m.m. set spread to other locations. they are primarily located in the soundview section of the bronx, as well as the south bronx and many east brooklyn neighborhoods like bedford-stuyvesant, brownsville, and east new york. they have also branched to cities as far as trenton, newark, and camden in new jersey, philadelphia pennsylvania, and baltimore, maryland, and other cities along i-95.  "
"sms","S.M.S","sms also s.m.s. (es-em-es) abbr.    1. noun. short message service: a text messaging service on mobile phones. 2. verb. to send a text message over a mobile phone."
"snd","S'N D","s'n d is an abbreviation for ""suckin dick""      the d can be replaced with the first letter of any other body part.  b=butt v=vagina"
"snu","Snus","moist, ground up tobacco. comes in many different flavors. commonly used under the upper lip, but some use it under the lower.  two variants; ordinary and portion snus. less dangerous and foul smelling than smoking, but can cause mouth and lip cancer. it's also a dead turn off.  since it almost only found in scandinavia, it's hell to take it through customs in other parts of the world."
"sok","S'Ok","a cross between '[its]' and '[ok]'. when you say it fast its s'ok (sokay). its very simple and short."
"sor","Sorry","an abbreviation for sorry, used when the speaker is only half sorry and thus uses half the word."
"sov","Sov-","sov- abbreviation for, ""sort of obvious"""
"soy","Soy","soy soy soy! soy gives you strength! strength crushes enemies! soy!"
"spx","Spox-","mostly using by polish mates, which means kewl; from polish spoko->spox->spx;"
"spy","Spy","a spy is an agent sent in for espionage. spies are rarely what they are in movies. they aren't kids like those lameass movies spy kids or cody banks. cody banks was fucking lame and inaccurate. cia agents don't work inside the u.s. james bond is a cool spy."
"sry","Sorry","short for sorry."
"ssy","Ssy","'ssy (pronounced ""cee"") is what happens when you drop the ""pu"" from ""pussy"" ...leaving just 'ssy. . . but it still refers to the pussy."
"sta","Stas","stas, a really sexy and sexual object. is very popular, and hard to get. so many try but fail."
"stu","Stud","aka stud ~ a sweet, country boy who woos women with his hellacious basketball skills and keen sense of what a real date should be {four-wheeling in the mud all day then hosing one another off}he's the epitome of punk in every sense of the term but it won't make you love him any less, oddly enough you'll find yourself helplessly enamoured"
"stx","Stx","acronym for sexually transmitted expectation: a chronic, debilitating, and rarely fatal disease caused by consensual sexual contact.  oddly, stx is passed by an uninfected carrier to an unsuspecting patient.  the hallmark of an stx diagnosis is manifestation in only one of the sexual partners."
"sty","Style","short for style"
"sue","Sues","a beautiful intelligent lady, who is determined to change the world for the greater good. her incredible smile lights up the room. her amazing personality and funny charm attracts men and women to want to be friends with her. it also helps that she has a nice rack. she is also one of the most caring people you will ever meet. she is a traveler and well cultured. most sues are athletic too. watch out for this powerhouse, she can be the biggest bitch if you cross her or her loved ones. sue would make a great teacher, lawyer, or accountant."
"suf","Spuf","steam(powered)users forums.  the steam forums are owned by the [valve] corporation.  a forum to discuss valve/[steam] games such as [half-life], [half-life 2], [counter-strike], [counter-strike: source], [day of defeat]...etc.  many people use the acronym [spuf] but according to one of the steam powered forum mods (blinxx), the correct acronym is ""suf."""
"sug","Sugar","a very enjoyable thing or person. sweet as sugar. a tasty treat."
"suj","Suj-","suj- shut up jerk! -school lockers- a-(getting books out of locker) b-(3 lockers along) hey c! look at that ugly goth chic lol c.>.> hmm yayr a. suj!"
"suk","Suck","lazy person's way to say suck... although it's only one letter, when used en mass (suksuksuksuksuksuksuksuksuksuksuksuksuksuksuksuksuksuksuksuksuksuksuksuksuksuksuksuksuksuksuksuksuksuksuksuksuksuk) it saves a lot of time"
"sum","Sums","sums is an acronym for spontaneous uncontrollable masturbation syndrome. sums is caused by puberty, boredom, lack of [action], high sex drive, hot people, ect. it is characterized by spontaneous and uncontrollable masturbation, often at inappropriate times such as at the park, when voting, or in line at the bank. "
