"koc","Koc","in almost every chatroom, one individual is quickly and informally identified as the “slowest” member of the community. this is individual is commonly referred to as the “koc.” the origin of the term is unclear. it may be derived from a psychological term. it may be an acronym. in any event, its use has become more prevalent over the past few years.  many in the chatroom are tolerant and spend a good portion of the chat each day explaining relatively simple concepts to the koc. others are less tolerant of the amount of time required to provide “remedial chat” since it detracts from the flow of conversation, i.e. “dumbs down” the chat.   an interesting aspect of this situation is the koc will usually not recognize the mocking and insults of the less tolerant chatters. if recognized, the koc will dismiss criticism as a function something other than his/her own individual characteristics, e.g. people are exhibiting racism, sexism, and/or elitism toward him/her.  similarly, the situation is complicated because the koc is usually unaware of his/her shortcomings and pretends to be more intellectually skilled and/or educated than is actually the case. this is obvious to all in the chatroom except the koc. one implication is frequently the domination of the conversation by the koc. often, the quality of the conversation and attendance of the chatroom suffers as a result.  in spite or because of his/her limitations, the koc is often opinionated. the koc will often adopt bizarre position on issues such as defending or minimizing rape, pedophilia, and animal cruelty. on it’s face, this appears to be an attention getting mechanism but familiarity with a koc reveals, these positions are sincerely held and are more likely the result of substantial intellectual deficits and associated deficits in social skills and language. however, the unevenness of development across areas suggests an acute event, e.g. brain injury, rather than garden-variety mental retardation.  since these problems (disabilities) are readily apparent to the chat group, members are often sympathetic, even when the koc remarks, other members of the group are “boring.” this pity sometimes results in members defending the koc even when he/she adopts significantly maladjusted and ridiculous position such as “sex is gross.” however, some members can not help involuntarily spitting on the screen when encountering such odd notions expressed by an adult.  the author believes a koc should be gently counseled into joining more appropriate chatrooms. however, the author also recognizes, chatrooms are usually not designed to provide the therapy and remedial assistance that would benefit a koc. in addition, a more “intellectually appropriate” chatroom may needlessly expose young children to a possibly dangerous individual.  please use the “comment” feature provided if you have experiences with a koc. "
"koj","Ko-J","ko-j is a term of endurance and affection for a sweet , gentle, caring, person of the male persuasion. he can be a ladies man, a gentleman, a sweet fun loving preppy

the root comes from the navajo name meaning ""friend to all!"""
"kok","Kok'","what happens when you try to say 'lol' but instead you type 'kok'"
"kon","K-On","k-on! (けいおん！） is a japanese four-panel comic strip seinen manga written and illustrated by kakifly. the four main characters in the beginning of the story are yui hirasawa (guitar), ritsu tainaka (drums), mio akiyama (bass), and tsumugi kotobuki (keyboard). later, azusa nakano (guitar) joins the keionbu (hence the anime's name, k-on!)."
"koo","Kool","to be kool."
"koy","Koy","a iu mien name sometimes named by iu mien parents so they could have a male child after the child named koy. also koy is a female iu mien name. also confused by the koi fish."
"kpb","Kpb","it is known as the difficult task to pull off going out and getting drunk for nights in a row. preferably wednesday,thursday, friday and saturday. although a difficult task, it has been achieved by the man himself known as kpb. also see super-kpb. "
"kph","Kph","kph ([konichi]s per hour.  kph is a term (relating to kilometers per hour, where faster is generally better) used to describe events and/or objects that add fun, entertainment or a positive spin to a gathering of friends/relatives/homies.  it would also be acceptable to use kpm ([konichi]s per minute - relating to a tachometer in an automobile) in a sense of describing something that's ""revving up"" the activity at hand."
"krb","Krb","kevin/rob/blake possey: a violent and mischievous trio that wreacked sarcastic havoc on thomas stone highschool in waldorf maryland. krb is responsible for embarressment of innumerable victims and the begining of what would come to be known as tip wars. krb invented the kevin goad song, and the chriss prairie song (with jazz interlude) and successfully completed one of the most dangerous and daring feats of them all: operation sound off."
"kri","Kris","kris. often a man of sexual desire to those who he himself does not want. an extremely attractive male with self esteem issues. artistic yet bold. wild but tame. a kris is a man to take power in a situation and rule it with an iron fist. unable to realize his true potential a kris will often mock his work. sweet and tempting, yet pushes away those who try to get close. a kris does not like to be touched. often found in a quiet room. he does not like drama. he tends to be quite mysterious. defiantly someone you want to know."
"krs","Krs","only a type of human being who lives their life in a lie. destined to be a natural failure. krs is a person who also desperately needs attention and sympathy from all those around them. the feature of a krs is a feature only a mother could love. thats if a krs even had a caring mother the begin with.."
"kry","Krys","someone with really, really unattractive friends who are girls, usually black or some kind of low spanish.

even he admits they are fugly. and ugly people have ugly friends. no one else will be friends with these losers, no one wants to be friends with ugly, nasty, asscrack faced girls so they make friends with krys, the only guy who will even talk to them

they pretend to defend each other and pretend to care about each other's feelings but it doesn't matter when they are donkey dick ugly

combined, their non-beauty could kill all living things in 100,000 mile radius. beware of his ugly friends, especially the ""girls"" you can probably see them coming because everyone will drop dead on the streets when they walk towards you"
"ksj","Ksjs","ksjs is san jose state university's campus radio station. it can be heard at 90.5 fm throughout the san francisco bay area and on the web at www.ksjs.org throughout the world. it is non-profit and entirely student run, 24 hours per day, 7 days a week, 365 days a year. the station offers a wide variety of music programming including hip hop, metal, electronic, and jazz. the music played on ksjs is an alternative to mainstream radio, so you'll hear only the best in independent and underground artists, as well as classic music that is not played on mainstream radio. ksjs also broadcasts a variety of public affairs shows, campus sports, and specialty shows. ksjs is also known as ""ground zero radio""."
"ktm","Ktms","a european motorcycle manufacturer, similar to husaberg. ktms decimate all other competition including honda, yamaha, kawasaki, and suzuki. ktms utilize superior engineering technology compared to japanese motorcycle manufacturers.

the rfs (racing four stroke) engine is one of the best engines ktm ever made.

ktms are also very successful in getting even the ugliest men laid.

however extreme care must be used around other men as ktms are known to cause other men to get hard-ons."
"ktv","Ktv","ktv or karaoke ktv, an entertainment establishment where you sit in a room and sing songs and drink alcohol surrounded by asians, and enjoy the 'line up' of hostesses which come as a nifty price of $60-80 an hour."
"ktx","Kthx","a shortened version of [kthx]."
"kue","Kue","kue is the most awesome person in the entire world. everyone should worship him, because he is awesome. if you do not agree you must be gay and a fan of gay people. plus kue is the drummer to the nobodies, one of the best underground bands in texas, and not to mention the world!"
"kug","Kug","kettle mug, a product designed in 2010 by alan harrison and ben millett in ireland. the kug is a portable mug with an element like a kettle so that you can do away with the need for a kettle and make hot drinks on the go. www.thekug.com"
"kuh","Kuhhh","cool, but not ""cool"", ""kuhhh""."
"kul","Kul","kul means coooooooooool! which means totally awexome! which means (if u dont know) kul!!!!!!!!!!  which means eli! which means, well, i am not gonna type it again, do a search on eli and u'll see."
"kup","K Up","slang- contraction for fuck, fuck up, or shut the fuck up.  1. contraction used to avoid misconduct, if in the time and place the latter words would be found inappropriate.  2. often used as a compound duplicate word."
"kur","Kur","aka kur 222 ma niggr burn 222 kur k-unit acid burnmaker trafik 2 b kur etctectectetcetctetctec..."
"kus","Kus'","'kus' in dutch means the same as the english word 'kiss'. however looking at the arabic meaning of this same word, when an arabic woman asks you to 'kus' her, you'd better realize what you're getting yourself getting into!"
"kuv","Kuv","kuv is a misspelled version of ""luv"" or ""love"". kuv is usually only said by stupid fifth graders who think that they're in love, but it can also be very cute if you're in the eighth grade through the twelfth grade. kuvs usually lead to multiple breakups with the same person, and when you accidentally break up with them while you are pmsing and your friends think that you should get back with some jerk, and you're hormonal enough to agree. you will usually ask the person you fell in kuv with to go back out with you, and they will incidentally be waiting for some random girl until they are allowed to date, which is incidentally in college. kuvs usually end up screwing you over because the person you are in kuv with turns out to be a total butt-head."
"kux","Kux","kux means poos, or to be a kux means that you are poos"
"kuy","Kuy","""kuy"" in thai slang word is defined directly as a male's genitals.  the word is rude and should only be used with close friends.   the word ""kuy"" is often used in conversation as a remark/reply to someone else.  can be compared to the word ""fuck you"" or ""ass""."
"kvs","Kvs","an alcoholic beverage consisting of a full glass of skol vodka and one packet of crystal light powder. in order to achieve the desired consistency, the powder may not be fully dissolved into the vodka. the kvs is typically consumed in a four round fashion, with the listed effect for each round. 1.) tipsy 2.) drunk 3.) blackout - shitty 4.) vomiting - exposure of ""glory parts""

p.s. - the disgusting, gritty aftertaste of each individual drink epitomizes the kvs."
"kwe","Kweli","pronounced ""kwah"", kwe is a word used to define a close-friend you deeply respect. derived from [talib kweli], famous [backpack] rapper, only true [vato]s use it."
"kxe","Kxe","straight edge is putting to much limits on someone. i didn't want to be confined by straight edge even though that is how i was raised. so i decided not to be straightedge, but no broken edge either, thus kxe was developed. katana edge is the lifestyle i have created at mc. the katana is arguably one of teh greatest and most practical sword ever made in human history. the blade is powerful and could severe flesh easily. it has a soft core to allow flexibility, but a hard edge to provide a strong blade so it won't break. the katana is a curved sword, not straght edge, it is like bending the rules instead of breaking the rules.  the curved blade allows me to bend the rules, if i want to drink, i'll drink, if i wanna smoke, i'll smoke, if i wanna do whatever iwant, i will. but, the katana was considered the soul of the japanese warrior, samurai. so is kxe like a soul to people who are kxe. although the katana is a great sword, with much abuse, it will break and rust and become worthless. just like the blade, if i abuse my body, my katana and soul, i too shall break. so the blade keeps me in check, allows me to do waht i want to do, but i musn't go overboard, lest i want my kxe to break."
"kym","Kym'S","kym's are normally really hot woman. they have smoking bodies and are drop-dread gorgeous. they are also very sweet, and make amazingly supportive, perfect girlfriends, not to mention a hot body! they are completely adorable, but often get mistreated or understood by men. there hot body often make them very attractive, and most are blonde and complete sweeties.

all boys want a kym, because they are are so fucking sexy."
"kyo","Kyo","kyo is an awesome french rock band made up of four people: benoît poher - vocalist; florian dubos - bass guitar / backing vocalist; fabien dubos - drums,programmations; nicolas chassagne - guitar, programmations   album list to date: kyo (released in 2000), le chemin (2003),and 300 lésions (2004).  they performed with dutch pop singer sita in their album le chemin.  "
"kyu","Kyu","used in martial arts to separate the kids from the grown-ups. a kid has a mon degree, a grown up (14 or above) has a kyu grade. a mon degree is white with a stripe of the colour while the kyu is fully coloured."
"laa","Laad'","short for 'lad' or 'laad'. meaning man, mate or boy. created in a conversation with harry graham."
"lac","Llac","short for cadillac."
"lad","Lads","an australian term used to describe teenagers who wear a nautica, polo or nike white hat, tilted upright revealing the front of their hair with the strap at the back done up tight so it is dangling out the back, a striped polo or nautica shirt with the collar popped and either saucony or nautica trackies or shorts, topped off with nike tnz which are fresh. these lads think they are tough but are generally small and skinny and travel in packs trying to roll other innocent bystanders for their worth."
"lag","Laggy","not to be confused with latency (the time it takes to send a packet to and recieve a response packet from a server along a network), lag is impaired computer functionality (slow application responses or reduced/choppy framerates) resulting from high latency, packet loss, or low-preformance (generally video) hardware  adj. laggy, vi. lag"
"lak","L.A.K","lak or l.a.k. is an abbreviation for larry ass kickers.  larry ass kickers are any tasks that become so difficult as to cause an individual to freeze up, stammer, or skip [like a record player].  laks can also cause paranoia, anger, and frustration.  while the origin of laks is not exactly known, some psychologists believe that they are triggered by ""muffin tops"" or ""moobs""."
"lap","Lap","(n) a person's lap is defined as the tops of their thighs.  when a person is sitting down, their lap is in a form such that another person can sit on it.  when a person stands up, their lap still exists but is not in a usable form."
"lar","Lars","girls tend to like lars. intelligent and smart, and knows how to use his tools. lars is everything a man has ever dreamed about being himself. lars is every girls perfect boyfriend."
"lau","Laugh","lau - standing for laugh at you the u comes from substituting the you for u "
"lay","Lay'S","to throw lay's chips at someone"
"laz","Lazy","totally worthless, of low moral character, extremley lazy, poor excuse for a human, usually extremley overweight, known to lie about others behind there back, taking credit for someone else's work"
"lbv","Lbvs","lbvs: laughing but very serious."
"lbw","L.B.W","l.b.w. entertainment is a recording label run by the rapper bow wow."
"lby","Lbys","lbys is a super moderator over at thebot.net. he isn't afraid to abuse his power and slap you with the banhammer. #plushclub #lbys4vip #tfl4ban"
"lcv","L.C.V","l.c.v. laos. cambodian. vietnamese."
"lcw","Lcw","this female is known to be deceptive, cunning, and backstabbing, while having the unwavering urge to fulfill sexual fantasies without regard for any destruction or pain this may cause others. this female will go to great lengths to mask and keep her liaisons' private thus reaffirming the acronym even more. be very wary when encountering this female as they come in many shapes and sizes, their greatest asset is the ability to blend in and deceive unsuspecting males into their web of lies, deception, and pain. as of now the only way to truly discover an lcw is to catch them in the act, but hopefully one day legislation will be passed to make it mandatory for these females to be branded with the ""lcw"" stamp across their forehead. thus exposing them to the ridicule of society as they rightfully should be. but until that becomes a reality, stay cautious when out at bars, clubs, parties and other social gatherings where the lcw is known to regularly hang out. also: college campuses are a breeding ground for this type of female so be extra cautious when around 18-24 year old females as most if not all probably have some affiliation with an lcw. and one final thing, once an lcw always an lcw so guys don't think just because she says she's changed that she has (that's the trick of the lcw!). they care about no one but themselves and are to caught up in their own egotistical, narcissistic self to feel any bit of remorse or empathy for anyone else!"
"ldp","Ldp","ldp stands for long distance (skateboard) pumping, also known as ""skumping.""   longboard-skateboard technology has rapidly advanced since the 1970's, and along with those changes is a new breed of distance-pumping skateboarder.    ldp sessions can be casual 5- to 10- mile pump cruises on flat bike / rollerblading trails, or a 26-mile all-out marathon, where a gyrating, pumping motion is the primary means for moving the skateboard forward!  check out skumping.com for articles, videos, and current information on this growing niche of skateboard pumping."
"lea","Leah","a girl who makes the guys go crazy with her charm and sexappeal. she flirts extremely with them but never ends up hooking up unless she is in a relationship. not to be comfused with leah who ands up in bed with every guy.  "
"lee","Lee","when used in the context of an australian male, the term/name ""lee"" denotes awesomeness, in 1842 a great man predicted that all males named ""lee"" in the year 1987 shall become 'king of the world' upon their 20th birthday.  because this great philosophiser was shot in the back while dancing to the 1842 one hit wonder ""hamertime"" (a song about communist oppression) the truth was never released to the public."
"lek","Lek","noun/verb: the bastard son of the three-way parenthood of ""lol"", ""lel"", and ""kek"", used when the previous expressions simply aren't edgy enough.

n(""that was a pretty loud lek, fam."")

v(""timothy's dank 4chan meme caused daniel to lek uncontrollably."")"
"len","Len","[len kagamine] is the second [vocaloid], along with rin kagamine, in [crypton future media]'s 'character vocal' series, including [miku hatsune], [luka megurine], and and unnamed cv04.

given that the program has two separate voicebanks, rin and len kagamine still sell for the same amount as miku hatsune; approximately $200 usd.

rin and len were first released december 27th with an act1 that was of terrible quality. [crypton] quickly released an act2, and gave users who purchased act1 the new act free of charge. act2 is no longer sold.

len is due to get 3 [appends], moody, soft, and power, december of 2010, and a possible english update, if miku hatsune's english update sells well.

len has many squealing [fangirls]. we know that his proven 'biggest fangirl' goes by the name of '[luna]' or '[krystal]'.

he is most often paired with kaito or rin, as far as vocaloid go, and is paired with ichine luna as far as [utau] go.

despite popular belief, len's name is spelt as it is on the box, 'len kagamine', not ren. rin and len's names are puns on right(rin) and left(len). the spelling is important."
"leo","Leos","persons born july 23rd to august 22nd.  ""leo is ruled by the sun so the personality is charismatic, strong and is created to shine.they take on responsibility, naturally.""  ""leos magnetic spirit and enthusiasm makes for success in any field but leos require autonomy and some individual power over their work.""  ""leo is queen of the zodiac. her royal presence demands respect. lions are like the sun itself, warm and radiant, ready to help great and small, an""d give without counting the cost. no-one is kinder than a lion, but can be badly hurt if people ignore or misunderstand them.""  ""if leo is your rising sign, you're naturally cheerful, and walk out onto the world's stage with a smile on your face. people are drawn to you, heads turn, and ...let's be honest... you love it! you're neither proud nor pushy, but sometmes people see you like that. ""  ""like every other aspect of life, love is for leos something mythical that should be experienced to the full. love should be significant, daring, spectacular and dramatic. a little affection is not their style. they love to be in love and they love playing the role of lover. with leos you’re in for a real love experience.""  ""leos are perfect lovers. they have the talent to create from every love something special and magical. they give the impression that two people are in love for the first time every in the history of the world. they love stylishly and without reservation and loyalty is part of their nature. although leos are vain and love being admired by members of the opposite sex, they are reliable partners and have the idealistic idea that love should be something dependable.""  excellent compatibility with geminis for romantic relationships."
"les","Likes","a girl who likes girls"
"ley","Ley","the most amazing person you will ever meet or come across. ley strives to be the greatest he can be at all times. ley is amazing, intelligent, straight forward, strong, ambitious, intuitive, and best of all, caring. he motivates and encourages those around him to do better and to be better.

ley is his own unique person. ley does not care about what others think of him. he knows he is handsome and attractive. he does not let the outside world determine his future. ley does not swim with the waves , but he pushes against them. ley walks his own path and creates a journey that any girl would be lucky to take with him.

ley will have you dreaming about bigger and better things in life, while also keeping you focus. any girl would be lucky to meet a guy like ley. ley does his best to keep his girl happy, while also keeping a smile on her face. ley walks with his head help high no matter the situation at hand and he will teach you do the same. he will remain on your mind for minutes at a time. ley will have you yearning for his presence and his smile. you wouldn't believe how much you could miss someone until you have ley in your life. ley will become the reason for your smile, your laughter, your excitement, happiness and most of all, the reason you learn to love who you are, inside and out. he sees your natural beauty as gorgeous. he appreciates all your flaws and the silly moments you will have him. ley presence is exuberant and his heart amazing, and there is no one like him."
"lha","Lhas","lhas stands for laughing hard as shyt its just another lol"
"lhf","Lhft","learn how to fucking spell.  a phrase used by real hackers/crackers who are annoyed by script kiddies and other wanna-be ""hackers"" that use so-called ""leet speak"" (l337 5p34k) -- especially if the ""leet speak"" is over-used, or used inncoorectly.  see also: lhft  "
"lhl","Lhl","lhl means laughing [hella] loud.

background information: [lol] has become very popular worldwide. everyone uses it in a conversation, mostly over text or via facebook or anyohther social network. [the bay area] california has always been the one to start trends. also [hella] originated from [the bay]/[northern california]. so trying to bring in the new 2011 with another trend from [the bay] out came [lhl] =[lauging hella loud]"
"lid","Lid'","opposite of a lad, someone who has no [banter] as they put a 'lid' on it. generally making them boring and party killers."
"lip","Lips","(noun) lips of the vaginal opening."
"lir","Liar","the russian way of saying ""liar""."
"lit","Light","the state of being so intoxicated (regardless of the intoxicating agent) that all the person can do is smile, so that they look lit up like a light."
"liu","Lius","lius: love is an under statement  the feeling greater than love itself spoken to an individual who makes you feel greater than you have ever felt and with every thought of them comes a smile, then a warm feeling of a comfortable bliss. "
"liw","Liw","a liw is one who wears reebok visors, nike tennis skirts and 'love australian open' shirts at school free-dress. a liw is one to use urban dictionary often in class time."
"liz","Liz'S","basically the definition of being amazingly cool and fun. can dance black as hell, whether their black or not. athletic, fun and wild. gets into trouble a lot. says stupid things, but people like liz's. sexy, and fiiiiiiiine."
"ljn","Ljn","a video game and toy company that used to be in business during 1970 - 1994. they made a lot of poor quality games, mostly movie licensed once. their games were of such poor quality that some people avoided the ljn rainbow sticker logo on plain sight.

so nowadays, the word ljn is simply associated with poor quality games and major disappointments in the gaming industry. an epic fail so to speak."
